{
  "intervention_id": "intv_001",
  "parcel_id": "parcel_001",
  "recorded_at": "2026-04-03T18:25:00Z",
  "hazard_target": "smoke",
  "action_kind": "hvac_recirculate_on",
  "initiated_by": "homeowner",
  "status": "completed",
  "baseline_window_minutes": 30,
  "evaluation_window_minutes": 90,
  "notes": "manual action after outdoor PM spike"
}
